Term	P-value	Genes
kinase activity (GO:0016301)	8.27385954876624E-4	MAP3K5,CLK3,PIK3CG,ROCK1,PIK3CD,EIF2AK1,TAOK1,MAP2K3,TGFBR3,SIK2,STRADB,CSNK1E,FN3K,MAPKAPK3,PIP5K1A,SGK3,PKLR,IGF1R,PDGFRB,STK17B,TRIO,NRP1,CAMKK2,ADK,CASK,STK3,MAP4K5,CDKL1,CSF1R,ACVR1B,MPP1,PRKCD,PANK1
neutral amino acid transmembrane transporter activity (GO:0015175)	0.0029645012509743798	SLC1A5,SLC6A9,SERINC1,SLC7A8
protein kinase activity (GO:0004672)	0.005101961616876671	MAP3K5,CLK3,ROCK1,EIF2AK1,PDGFRB,STK17B,TAOK1,MAP2K3,TRIO,TGFBR3,NRP1,CAMKK2,SIK2,STRADB,CSNK1E,STK3,MAP4K5,CDKL1,MAPKAPK3,CSF1R,ACVR1B,SGK3,PRKCD,IGF1R
transferase activity (GO:0016740)	0.0053591916875453255	MAP3K5,PIK3CG,PIK3CD,EIF2AK1,TAOK1,STRADB,CSNK1E,WHSC1L1,FN3K,MAPKAPK3,PKLR,STK17B,NRP1,CHST10,ADK,FUT4,F13A1,CASK,DNTT,CSF1R,PRKCD,CHST1,PANK1,OXCT1,HS6ST1,CLK3,ROCK1,MAP2K3,TGFBR3,SIK2,SHMT1,ST3GAL2,ST3GAL5,PCYT1B,PIP5K1A,ALAS2,SGK3,GALNT6,IGF1R,PDGFRB,GCNT2,UHMK1,GCNT1,TRIO,CAMKK2,STK3,MAP4K5,CDKL1,ACVR1B,PIGA,MPP1,MGST3,MGST1
calmodulin binding (GO:0005516)	0.0054922440810733185	CALD1,CAMKK2,DAPK1,RGS2,MARCKS,RIT1
growth factor binding (GO:0019838)	0.008330748637559752	IL6ST,ACVR1B,CSF2RB,PDGFRB,IGF1R,THBS1,TGFBR2,TGFBR3
protein tyrosine phosphatase activity (GO:0004725)	0.009069583633214794	PTPRS,PTPN6,PTPRE,PTPN18,CDKN3,CDC25B,PTP4A3,DUSP8
phospholipid binding (GO:0005543)	0.00948286467098582	HIP1R,APOE,SCIN,PLEK,WIPI1,ANXA4,ABCG1,ARAP2,PLEKHA2
enzyme inhibitor activity (GO:0004857)	0.013414914644632698	IQGAP2,IBTK,SERPINF1,CST7,ARRB1,TIMP2,CDKN1A,CDKN1B,SPINT2,CD27,ANXA4,ANXA2,GMFG
cytoskeletal protein binding (GO:0008092)	0.013488437781003127	APOE,ADD2,PXN,MARCKS,RPH3AL,FLNB,TRIOBP,IQGAP2,ANK1,SLC4A1,GABARAPL2,MYH10,ATG4D,ATG4A,CALD1,PAFAH1B1,COTL1
lipid binding (GO:0008289)	0.0141609060115507	APOE,WIPI1,ABCG1,PLEKHA2,HIP1R,STX3,SCIN,ALOX5AP,RASGRP2,SHMT1,PLEK,SELL,ANXA4,ARAP2
transforming growth factor beta binding (GO:0050431)	0.015641819687894944	TGFBR2,TGFBR3,THBS1
phosphoinositide binding (GO:0035091)	0.016870603358234613	HIP1R,PLEK,WIPI1,SCIN,ARAP2
ATPase binding (GO:0051117)	0.019294625055484915	GABARAPL2,LCK,ATP6V0A1
SMAD binding (GO:0046332)	0.020976773015595022	ACVR1B,FOS,TGFBR2,JUN,TGFBR3
enzyme regulator activity (GO:0030234)	0.0230641619554276	MAP3K5,APOE,IBTK,SERPINF1,JUN,PPP2R3A,TRIO,RGS2,HERC1,BNIP2,RASA3,CD27,IQGAP2,RCBTB2,ARRB1,CST7,TIMP2,CDKN1A,CDKN1B,DNAJB6,SPINT2,PRKCD,RASGRP2,ANXA4,ANXA2,GMFG
phosphoprotein phosphatase activity (GO:0004721)	0.028333007255540967	PTPRS,LCK,PTPN6,PTPRE,PTPN18,CDKN3,CDC25B,PTP4A3,DUSP8
protein kinase inhibitor activity (GO:0004860)	0.028876754768541797	IBTK,CDKN1A,CDKN1B,GMFG
protein serine/threonine kinase activity (GO:0004674)	0.03225852206890465	MAP3K5,CLK3,ROCK1,EIF2AK1,STK17B,TAOK1,TRIO,TGFBR3,SIK2,CSNK1E,STK3,MAP4K5,CDKL1,ACVR1B,SGK3,PRKCD
kinase inhibitor activity (GO:0019210)	0.03619632794407031	IBTK,CDKN1A,CDKN1B,GMFG
purine nucleotide binding (GO:0017076)	0.04321785656584496	MAP3K5,ABCB10,STK17B,UHMK1,TAOK1,ABCG1,RIT1,SIK2,ARL4A,GCH1,STK3,MAP4K5,ABCA2,ADSSL1,MYH10,PPOX,ACVR1B,DAPK1,NDOR1
amino acid transmembrane transporter activity (GO:0015171)	0.04449011692816478	SLC7A8,SLC1A5,SERINC1,SLC6A9
cysteine-type peptidase activity (GO:0008234)	0.04936558231347512	USP11,USP15,ATG4D,ATG4A,USP25,CTSF
identical protein binding (GO:0042802)	0.05448949313526048	MAP3K5,ROCK1,BCL2L1,FNBP1,SHMT1,PTP4A3,BNIP3L,ZXDC,HEXB,IGF1R,IL6ST,APOE,ADD2,CLCN3,ABCG1,PON2,GYPA,GCH1,BCL2,THBS1,PLEK,SLC4A1,STRAP,PSME3,OXCT1,MPG
protease binding (GO:0002020)	0.05675187035971043	CST3,CRADD,BCL2
hydrolase activity, acting on ester bonds (GO:0016788)	0.05762181247267565	PLD3,PTPRS,ACP5,GALNS,PTPN18,PON2,SYNJ1,CDKN3,PTP4A3,DUSP8,CNP,PDE4B,PTPN6,DNA2,PLCG1,PDE7A,HAGH,LCK,ERCC4,PTPRE,CDC25B
enzyme binding (GO:0019899)	0.058433774697315796	IBTK,CCND3,TRIOBP,CARHSP1,BCL2,PLEK,ATP6V0A1,FOXO4,CRADD,ANK1,CST3,RNF138,GABARAPL2,ACVR1B,PRKCD,LCK,IGF1R,PAFAH1B1,COTL1
carboxylic acid transmembrane transporter activity (GO:0046943)	0.06761981871587408	SLC7A8,SLC1A5,SLC16A1,SERINC1,SLC6A9
acetylglucosaminyltransferase activity (GO:0008375)	0.07107653876069664	GCNT2,GCNT1,PIGA
lipid kinase activity (GO:0001727)	0.07107653876069664	PIK3CG,PIK3CD,PIP5K1A
protein heterodimerization activity (GO:0046982)	0.07623862123626778	APOE,ADD2,CLCN3,TGFBR2,ABCG1,HEXB,BCL2,CYBA,BNIP3L
guanylate kinase activity (GO:0004385)	0.07624224981059474	MPP1,CASK
1-phosphatidylinositol-3-kinase activity (GO:0016303)	0.07624224981059474	PIK3CG,PIK3CD
sialyltransferase activity (GO:0008373)	0.07624224981059474	ST3GAL2,ST3GAL5
ubiquitin-specific protease activity (GO:0004843)	0.07878764924594946	USP11,USP25,USP15
protein binding (GO:0005515)	0.08173371700614221	BTBD2,LASP1,ARHGEF12,MDFIC,LRRK1,IFITM2,UBE2V2,CDKN1B,E2F2,SH2D4A,FRYL,SELPLG,IL6ST,ACAP1,TYROBP,FCGR2B,MKRN1,SLC16A1,FOS,LAIR1,XPC,TIPARP,PTPRS,HMG20A,RPTOR,IL18BP,EIF5A2,CAPN2,BNIP3L,IQGAP2,VAV1,CSF2RB,ATG4D,ATG4A,NDOR1,TRAK2,PDGFRB,ADD2,PXN,HIP1R,GYPA,CAMKK2,MED6,GADD45A,ITPR3,SLC4A1,SOCS2,TNS3,STRAP,GADD45GIP1,SCARB2,PTPN6,PARD6G,GSN,PIGA,KHDRBS3,HIPK1,HIPK2,PTPRE,NFIA,PPP2R3A,PABPC4,ELF2,ARL4A,PTP4A3,SFPQ,ZXDC,VAMP2,CYBA,ID2,CATSPER2,XK,AFAP1L1,KLF7,ETS1,ETS2,RIT1,ICAM2,PRTN3,BCL2,ETV6,MS4A3,AGFG1,COMMD8,CYFIP2,SORL1,PRKCD,TRA2B,OXCT1,BRPF3,ROCK1,FNBP1,MARCKS,CREG1,HIST2H2BE,RASSF5,BTRC,ANK1,HHEX,MAD2L1BP,ALAS2,CPSF6,LCP2,VPREB1,IGF1R,HOMER1,ABCG1,NOTCH1,THBS1,CDKN3,SOX4,ELK3,NDRG1,PSMB8,BTG2,PSME3,MAP3K5,BRAF,JUN,ARIH1,FNIP2,RGS2,HTATIP2,USP11,USP15,ALOX12,CSNK1E,ARRB1,RNF138,LRBA,CEBPA,CNNM3,APOE,APOA1BP,KRT10,KRT18,UBP1,NRP1,SIGIRR,CD27,PLEK,ATP6V0A1,FOXO4,TOR1AIP2,FECH,CST3,RIOK3,CYTIP,CD93,NFAT5,ERCC4,TXNIP,TUBB2A,IBTK,NCF4,NPHP1,MAP2K3,TGFBR2,TGFBR3,FLNB,CCND3,NSD1,TBC1D5,SHMT1,SIX5,TNFRSF13B,WIPI1,XPO7,HEXB,NCOA7,CDK6,LCK,COTL1,PDLIM7,RAVER1,CDR2,LOR,HOXA9,RNF11,RNF10,GABARAPL2,DAPK1,SMO,CALD1,MTHFR,PIK3CG,PIK3CD,BCL2L1,BNIP2,RAB8B,IKBKG,EBF1,DNAJB2,DNAJB6,SLC1A5,CLCN3,SEPN1,SCAI,RAB3A,TRIOBP,CARHSP1,PPFIA1,CAST,SEPT4,DSP,ITGAL,EIF4H,CCDC50,MPG,ADAM9,GRB10,SERTAD3,MXD1,MXD4,ALOX5AP,SLC7A8,CBFB,CRADD,SLC2A4,NUDT6,TIMP2,MYH10,ARPC5L,VIM,PAFAH1B1,FBN1,CDC25B,GCC1,UHMK1,S100A10,BET1L,PON2,NARF,RPH3AL,GCH1,THRA,MAP4K5,PLCG1,KCTD12,ACVR1B,CTSG,RGS19
nucleoside binding (GO:0001882)	0.08634417318351396	MAP3K5,ABCB10,STK17B,UHMK1,TAOK1,ABCG1,SIK2,STK3,MAP4K5,ABCA2,MYH10,PPOX,ACVR1B,DAPK1,NDOR1
nucleotide binding (GO:0000166)	0.0887165280022863	MAP3K5,ABCB10,STK17B,UHMK1,TAOK1,ABCG1,RIT1,SIK2,ARL4A,GCH1,STK3,MAP4K5,ABCA2,ADSSL1,MYH10,PPOX,ACVR1B,DAPK1,NDOR1
R-SMAD binding (GO:0070412)	0.08900761484435468	FOS,JUN
lipase inhibitor activity (GO:0055102)	0.08900761484435468	ANXA4,ANXA2
beta-amyloid binding (GO:0001540)	0.08900761484435468	APOE,CST3
glucose transmembrane transporter activity (GO:0005355)	0.08900761484435468	SLC2A4,PPBP
transcription factor activity (GO:0003700)	0.08950567713437825	HMG20A,JUN,ELF2,MXD1,LMO4,CBFB,HHEX,VAV1,E2F2,CEBPA,KLF7,UBP1,ETS1,ETS2,KLF3,ETV6,HCLS1,AFF1,THRA,FOXO4,HOXC5,SOX4,SOX6,ELK3,MAFG,NFAT5,IRF8,NFIA
protein homodimerization activity (GO:0042803)	0.09032208585272979	IL6ST,MAP3K5,APOE,ADD2,CLCN3,ABCG1,GCH1,BCL2,SHMT1,PLEK,BNIP3L,SLC4A1,HEXB,OXCT1
phosphate binding (GO:0042301)	0.10234685032884264	MTHFD2,ADSSL1
endodeoxyribonuclease activity (GO:0004520)	0.10234685032884264	DNA2,ERCC4
MAP kinase kinase activity (GO:0004708)	0.10234685032884264	MAP2K3,MAPKAPK3
antioxidant activity (GO:0016209)	0.1039434930738004	MGST3,APOE,MPO
receptor signaling protein activity (GO:0005057)	0.10943110741814102	MAP3K5,SOCS2,TYROBP,CDKN1B,PLCG1,TGFBR3,ACVR1B,IL18BP
promoter binding (GO:0010843)	0.1129515016682438	THRA,FOS,JUN
transforming growth factor beta receptor activity (GO:0005024)	0.11618888787146961	ACVR1B,TGFBR3
insulin receptor binding (GO:0005158)	0.11618888787146961	IGF1R,GRB10
actin binding (GO:0003779)	0.12060777590815565	IQGAP2,FLNB,ADD2,CALD1,COTL1,MARCKS,MYH10
cytokine binding (GO:0019955)	0.12201014980143911	IL6ST,CSF2RB,IL18BP,THBS1,TGFBR2,TGFBR3
inositol or phosphatidylinositol kinase activity (GO:0004428)	0.12224414745952851	PIP5K1A,PIK3CG,PIK3CD
damaged DNA binding (GO:0003684)	0.12224414745952851	ERCC4,MPG,XPC
cysteine-type endopeptidase activity (GO:0004197)	0.12861197185522227	USP11,USP15,ATG4D,CTSF
protein dimerization activity (GO:0046983)	0.1314630058219754	IL6ST,MAP3K5,APOE,NCF4,ADD2,CLCN3,TGFBR2,ABCG1,GCH1,BCL2,SHMT1,PLEK,BNIP3L,SLC4A1,HEXB,OXCT1,CYBA
carbohydrate binding (GO:0030246)	0.1353842017658583	CD34,LGALS3,TGFBR2,TGFBR3,PAFAH1B1,THBS1,SELL,NDOR1
amine transmembrane transporter activity (GO:0005275)	0.13618321979550768	SLC7A8,SLC1A5,SERINC1,SLC6A9
actin filament binding (GO:0051015)	0.14161757259153018	MARCKS,ADD2,MYH10
protein binding, bridging (GO:0030674)	0.14417990468932132	LOR,CRADD,SOCS2,GRB10,DSP,LASP1
nucleotide kinase activity (GO:0019201)	0.14512158906252468	MPP1,CASK
fatty acid binding (GO:0005504)	0.14512158906252468	STX3,ALOX5AP
transforming growth factor beta receptor binding (GO:0005160)	0.14512158906252468	TGFBR2,TGFBR3
3',5'-cyclic-nucleotide phosphodiesterase activity (GO:0004114)	0.14512158906252468	PDE7A,PDE4B
glycoprotein binding (GO:0001948)	0.14512158906252468	LCK,THBS1
binding (GO:0005488)	0.154406213083286	GDA,BTBD2,LASP1,ARHGEF12,LRRK1,IFITM2,FRYL,SELPLG,IL6ST,ABCB10,ACAP1,TYROBP,SLC16A1,PLEKHA2,PPOX,FOS,XPC,TIPARP,OPA1,HMG20A,PTPRS,HLF,BNIP3L,VAV1,CSF2RB,ATG4D,ATG4A,ADD2,HIP1R,GYPA,CAMKK2,MED6,ITPR3,SLC4A1,SATB1,SOCS2,SCARB2,MAFG,PTPN6,PARD6G,GSN,PTPRE,NFIA,PABPC4,ELF2,ARL4A,PTP4A3,LMO4,ZXDC,VAMP2,ABCA2,CYBA,ID2,CATSPER2,XK,KLF7,HPCAL1,RIT1,KLF3,BCL2,AGFG1,COMMD8,CYFIP2,SORL1,PRKCD,IRF8,FNBP1,MARCKS,CREG1,HIST2H2BE,RNASEL,BTRC,HHEX,CPSF6,ABCG1,AFF1,SOX4,SOX6,ELK3,ADSSL1,PSMB8,BTG2,PSME3,RASGRP2,FNIP2,HTATIP2,USP11,USP15,CSNK1E,ARRB1,CEBPA,CNNM3,APOE,KRT10,KRT18,UBP1,SIGIRR,PLEK,ATP6V0A1,FOXO4,TOR1AIP2,FECH,NFAT5,ERCC4,ARAP2,TUBB2A,IBTK,TGFBR2,TGFBR3,CCND3,TBC1D5,SHMT1,HEXB,COTL1,PDLIM7,RAVER1,LGALS3,SEC14L1,HOXC5,RNF11,HOXA9,RNF10,SMO,CALD1,MTHFR,EBF1,SLC1A5,CLCN3,SCAI,PPFIA1,DSP,ITGAL,EIF4H,ADIPOR1,CCDC50,SCIN,MTHFD2,SERTAD3,MXD1,MXD4,CRADD,SLC2A4,NUDT6,VIM,PAFAH1B1,FBN1,GCC1,UHMK1,PON2,GCH1,STK3,PLCG1,ACVR1B,RGS19,IGHM,TAOK1,MDFIC,UBE2V2,CDKN1B,E2F2,SH2D4A,STK17B,FCGR2B,MKRN1,RC3H2,LAIR1,RPTOR,IL18BP,EIF5A2,SELL,CAPN2,IQGAP2,TRAF4,NDOR1,TRAK2,PDGFRB,PXN,GADD45A,TNS3,STRAP,GADD45GIP1,PIGA,KHDRBS3,HIPK1,HIPK2,CENPB,PPP2R3A,SFPQ,AFAP1L1,ETS1,ETS2,ICAM2,PRTN3,ETV6,MS4A3,TRA2B,OXCT1,BRPF3,ROCK1,RASSF5,ANK1,MAD2L1BP,ALAS2,LCP1,LCP2,VPREB1,IGF1R,H2AFY,HOMER1,NOTCH1,THBS1,CDKN3,NDRG1,MAP3K5,BRAF,JUN,ARIH1,ARIH2,RGS2,ALOX12,RNF138,LRBA,APOA1BP,CD34,NRP1,CD27,HCLS1,CST3,RIOK3,CYTIP,CD93,TXNIP,NCF4,NPHP1,MAP2K3,SIK2,FLNB,NSD1,SIX5,TNFRSF13B,WIPI1,XPO7,NCOA7,CDK6,LCK,CDR2,LOR,GABARAPL2,DAPK1,PIK3CG,PIK3CD,BCL2L1,BNIP2,RAB8B,IKBKG,DNAJB2,DNAJB6,SEPN1,TRIOBP,RAB3A,CARHSP1,CAST,SEPT4,MPG,MPO,ADAM9,GRB10,STX3,ALOX5AP,SLC7A8,CBFB,TIMP2,MYH10,TRIM2,ARPC5L,ANXA4,CDC25B,S100A10,BET1L,NARF,RPH3AL,STAU2,THRA,MAP4K5,KCTD12,CTSG
ADP binding (GO:0043531)	0.16009375398093506	ABCG1,MYH10
peroxidase activity (GO:0004601)	0.16009375398093506	MGST3,MPO
receptor serine/threonine kinase binding (GO:0033612)	0.16009375398093506	TGFBR2,TGFBR3
phosphatidylinositol binding (GO:0005545)	0.16009375398093506	WIPI1,SCIN
transcription corepressor activity (GO:0003714)	0.16135607663458854	ELK3,UBP1,CREG1,SCAI,MXD1,MXD4,HIPK2
endopeptidase inhibitor activity (GO:0004866)	0.16658620673788152	SPINT2,SERPINF1,CST7,TIMP2,CD27
transmembrane receptor protein tyrosine kinase activity (GO:0004714)	0.16815578007202722	NRP1,IGF1R,CSF1R,PDGFRB
protein kinase regulator activity (GO:0019887)	0.16815578007202722	IBTK,CDKN1A,CDKN1B,GMFG
ATP binding (GO:0005524)	0.1708160873312508	MAP3K5,ABCB10,STK17B,UHMK1,TAOK1,SIK2,STK3,MAP4K5,ABCA2,MYH10,ACVR1B,DAPK1
glutathione transferase activity (GO:0004364)	0.17533118881115284	MGST3,MGST1
carboxypeptidase activity (GO:0004180)	0.17533118881115284	CPA3,CPD
low-density lipoprotein binding (GO:0030169)	0.17533118881115284	SORL1,THBS1
protein complex binding (GO:0032403)	0.1805678988952128	ACVR1B,ADAM9,ICAM2,GRB10,IGF1R,THBS1
heparin binding (GO:0008201)	0.18305402357493925	PAFAH1B1,SELL,TGFBR3
magnesium ion binding (GO:0000287)	0.18808847718149913	MTHFD2,MAP3K5,SIK2,OPA1,STK3
GTPase activity (GO:0003924)	0.19012792519345453	SEPT4,OPA1,RHOBTB3,RAB8B,RHOJ,GNAQ,ARL4A,RAB3A
cysteine-type endopeptidase inhibitor activity (GO:0004869)	0.19078485759793898	CST7,CD27
transmembrane receptor protein tyrosine phosphatase activity (GO:0005001)	0.19078485759793898	PTPRE,PTPRS
guanyl-nucleotide exchange factor activity (GO:0005085)	0.20246918039476242	RCBTB2,HERC1,RASGRP2,TRIO
protein tyrosine kinase activity (GO:0004713)	0.2029502803547306	NRP1,CAMKK2,PDGFRB,IGF1R,CSF1R
RNA polymerase II transcription factor activity (GO:0003702)	0.2032214394261172	CBFB,JUN,ETS1,E2F2,HTATIP2,FOS,CREG1,MED6,NFAT5,CEBPA,IRF8
SH3 domain binding (GO:0017124)	0.2064093776122024	CYBA,ADAM9
RNA polymerase II transcription factor activity, enhancer binding (GO:0003705)	0.2064093776122024	CEBPA,IRF8
calcium ion binding (GO:0005509)	0.2120632545989889	HPCAL1,CAMKK2,GSN,BNIP2,SCIN,LCP1,RASGRP2,FBN1
sulfotransferase activity (GO:0008146)	0.21597204334535008	CHST10,HS6ST1,CHST1
enzyme activator activity (GO:0008047)	0.2201117118100909	MAP3K5,APOE,JUN,RGS2,DNAJB6,PRKCD,BNIP2,RASA3,GMFG
glycosaminoglycan binding (GO:0005539)	0.22034957353346604	PAFAH1B1,SELL,TGFBR2,TGFBR3
hormone binding (GO:0042562)	0.222162799432983	ADIPOR1,IGF1R
kinase binding (GO:0019900)	0.22707208980453725	IBTK,CCND3,LCK,RNF138,IGF1R,PLEK
hydrolase activity (GO:0016787)	0.2289854083551778	GDA,USP11,USP15,USP25,ARL4A,PTP4A3,DUSP8,ABCA2,RAB8B,PLD3,RAB3A,SEPT4,NAPSA,RHOBTB3,ERCC4,OPA1,PTPRS,ACP5,SYNJ1,MTHFD2,GNAQ,PDE4B,CPA3,NUDT4,DNA2,PDE7A,MYH10,RHOJ,HEXB,MAN1A2,HAGH,ATG4D,ATG4A,LCK,CDC25B,GALNS,PTPN18,ABCG1,PON2,RAD54B,GCH1,CDKN3,CNP,CPD,PTPN6,PLCG1,CTSG,CTSF,PTPRE
DNA binding (GO:0003677)	0.2408021522871509	JUN,ELF2,LMO4,E2F2,CEBPA,KLF7,UBP1,ETS1,ETS2,KLF3,ETV6,HCLS1,FOXO4,RC3H2,FOS,XPC,NFAT5,ERCC4,MPG,IRF8,HMG20A,HLF,MXD1,HIST2H2BE,CBFB,HHEX,TRAF4,VAV1,H2AFY,AFF1,THRA,HOXC5,SATB1,SOX4,ELK3,SOX6,RNF11,MAFG,CENPB,NFIA
protein kinase binding (GO:0019901)	0.24167939825154075	IBTK,CCND3,LCK,RNF138,PLEK
metal ion binding (GO:0046872)	0.245821066855118	GDA,MAP3K5,OPA1,ARIH2,MTHFD2,SIK2,BNIP2,TRIM2,LCP1,FBN1,APOE,KLF7,HPCAL1,CAMKK2,GCH1,FECH,STK3,RNF11,GSN,SCIN,RASGRP2
microtubule binding (GO:0008017)	0.26152195198184114	GABARAPL2,ATG4D,ATG4A
molecular adaptor activity (GO:0060090)	0.2666637833600171	ANK1,SOCS2,GRB10,LASP1
deoxyribonuclease activity (GO:0004536)	0.2698241928545129	DNA2,ERCC4
PDZ domain binding (GO:0030165)	0.2698241928545129	CLCN3,TGFBR3
cofactor binding (GO:0048037)	0.27310934943262866	PPOX,SHMT1,NDOR1
receptor signaling protein serine/threonine kinase activity (GO:0004702)	0.27310934943262866	ACVR1B,MAP3K5,TGFBR3
integrin binding (GO:0005178)	0.27310934943262866	THBS1,ADAM9,ICAM2
lipoprotein binding (GO:0008034)	0.2857353499236034	SORL1,THBS1
chloride channel activity (GO:0005254)	0.2857353499236034	CLCN3,CLCA1
caspase regulator activity (GO:0043028)	0.2857353499236034	MAP3K5,CD27
GTPase activator activity (GO:0005096)	0.2952554107600915	BNIP2,JUN,RASA3,RGS2
collagen binding (GO:0005518)	0.3016102687307599	THBS1,ADAM9
sequence-specific DNA binding (GO:0043565)	0.3139864423422675	THRA,JUN,ELK3,ELF2,FOS,CENPB
protein transporter activity (GO:0008565)	0.3174236107817106	ABCG1,RAMP1
androgen receptor binding (GO:0050681)	0.3174236107817106	WIPI1,NSD1
transferase activity, transferring glycosyl groups (GO:0016757)	0.3181112013423396	ST3GAL2,ST3GAL5,GCNT2,GCNT1,PIGA,GALNT6,FUT4
GTP binding (GO:0005525)	0.3242096993838672	ARL4A,GCH1,ADSSL1,RIT1
SH3/SH2 adaptor activity (GO:0005070)	0.34331379357379954	SOCS2,GRB10,LASP1
MAP kinase kinase kinase activity (GO:0004709)	0.35102583254697245	MAP3K5
activin binding (GO:0048185)	0.35102583254697245	ACVR1B
caspase inhibitor activity (GO:0043027)	0.35102583254697245	CD27
cytoskeletal adaptor activity (GO:0008093)	0.35102583254697245	ANK1
receptor antagonist activity (GO:0048019)	0.35102583254697245	IL18BP
estrogen receptor binding (GO:0030331)	0.35102583254697245	WIPI1
structural constituent of cytoskeleton (GO:0005200)	0.35334287771216427	LOR,ANK1,DSP,VIM
structure-specific DNA binding (GO:0043566)	0.35334287771216427	HLF,SATB1,XPC,ERCC4
sterol transporter activity (GO:0015248)	0.3785041908234852	ABCG1
protein kinase C binding (GO:0005080)	0.3785041908234852	PLEK
insulin-like growth factor binding (GO:0005520)	0.3785041908234852	IGF1R
GTPase inhibitor activity (GO:0005095)	0.3785041908234852	IQGAP2
SNARE binding (GO:0000149)	0.3785041908234852	GABARAPL2
transcription repressor activity (GO:0016564)	0.4003176666214412	ELK3,UBP1,ELF2,CREG1,SCAI,MXD1,MXD4,HIPK2,ID2
protein domain specific binding (GO:0019904)	0.40154589315999023	CRADD,ADAM9,CLCN3,TGFBR3,LCK,BCL2,CYBA
fucosyltransferase activity (GO:0008417)	0.40482206136197274	FUT4
nucleoside kinase activity (GO:0019206)	0.40482206136197274	ADK
oxidoreductase activity, acting on single donors with incorporation of molecular oxygen, incorporation of two atoms of oxygen (GO:0016702)	0.40482206136197274	ALOX12
histone methyltransferase activity (GO:0042054)	0.40482206136197274	WHSC1L1
myosin binding (GO:0017022)	0.40482206136197274	TRIOBP
low-density lipoprotein receptor binding (GO:0050750)	0.40482206136197274	APOE
metallocarboxypeptidase activity (GO:0004181)	0.40482206136197274	CPA3
transforming growth factor beta receptor, cytoplasmic mediator activity (GO:0005072)	0.40482206136197274	CDKN1B
voltage-gated anion channel activity (GO:0008308)	0.40482206136197274	CLCN3
insulin-like growth factor receptor binding (GO:0005159)	0.40482206136197274	SOCS2
coenzyme binding (GO:0050662)	0.40985145788934013	PPOX,NDOR1
endonuclease activity (GO:0004519)	0.424692184371166	ERCC4,DNA2
acetylgalactosaminyltransferase activity (GO:0008376)	0.4300283289499723	GALNT6
transmembrane receptor protein serine/threonine kinase signaling protein activity (GO:0005071)	0.4300283289499723	CDKN1B
bacterial binding (GO:0008367)	0.4300283289499723	SELPLG
delayed rectifier potassium channel activity (GO:0005251)	0.4300283289499723	KCNA3
eukaryotic cell surface binding (GO:0043499)	0.4300283289499723	THBS1
organic cation transmembrane transporter activity (GO:0015101)	0.4300283289499723	SLC7A8
protein serine/threonine phosphatase activity (GO:0004722)	0.4393369213959643	CDKN3,LCK
Rho GTPase binding (GO:0017048)	0.45416982441806825	TRIOBP
p53 binding (GO:0002039)	0.45416982441806825	PSME3
NADP or NADPH binding (GO:0050661)	0.45416982441806825	NDOR1
monocarboxylic acid transmembrane transporter activity (GO:0008028)	0.45416982441806825	SLC16A1
microfilament motor activity (GO:0000146)	0.45416982441806825	MYH10
caspase activator activity (GO:0008656)	0.45416982441806825	MAP3K5
steroid hormone receptor binding (GO:0035258)	0.4679996763623958	WIPI1,NSD1
ubiquitin protein ligase binding (GO:0031625)	0.4772914107410228	ACVR1B
cholesterol binding (GO:0015485)	0.4772914107410228	ABCG1
carboxy-lyase activity (GO:0016831)	0.4772914107410228	HDC
heat shock protein binding (GO:0031072)	0.4772914107410228	DNAJB6
tubulin binding (GO:0015631)	0.48014854067079205	ATG4D,ATG4A,GABARAPL2
double-stranded DNA binding (GO:0003690)	0.4957736318282505	HLF,SATB1
lipid transporter activity (GO:0005319)	0.4957736318282505	APOE,ABCG1
serine-type endopeptidase inhibitor activity (GO:0004867)	0.4957736318282505	SPINT2,SERPINF1
chromatin binding (GO:0003682)	0.4957736318282505	CENPB,MPO
SH2 domain binding (GO:0042169)	0.49943606552732045	LCK
apoptotic protease activator activity (GO:0016505)	0.49943606552732045	MAP3K5
inositol or phosphatidylinositol phosphatase activity (GO:0004437)	0.49943606552732045	SYNJ1
lipoprotein receptor binding (GO:0070325)	0.49943606552732045	APOE
phosphoinositide phospholipase C activity (GO:0004435)	0.49943606552732045	PLCG1
ligase activity (GO:0016874)	0.5051695844668983	CTPS2,ARIH1,ADSSL1,UBE2E2,UBE2H,UBE2C,ACSL6
cytokine receptor activity (GO:0004896)	0.5093112369648876	IL6ST,CSF2RB
single-stranded DNA binding (GO:0003697)	0.5093112369648876	ERCC4,XPC
double-stranded RNA binding (GO:0003725)	0.5206449599944539	STAU2
single-stranded RNA binding (GO:0003727)	0.5206449599944539	PABPC4
protein phosphatase type 2A regulator activity (GO:0008601)	0.5206449599944539	PPP2R3A
chaperone binding (GO:0051087)	0.5206449599944539	DNAJB6
coreceptor activity (GO:0015026)	0.5206449599944539	TGFBR3
phospholipase C activity (GO:0004629)	0.5206449599944539	PLCG1
steroid binding (GO:0005496)	0.5226092150828572	SHMT1,ABCG1
structural constituent of muscle (GO:0008307)	0.5226092150828572	TPM4,MYL9
transcription factor binding (GO:0008134)	0.5282146806808795	JUN,KLF7,UBP1,ETS1,HTATIP2,CREG1,SCAI,MXD1,MXD4,MED6,FOXO4,MDFIC,HHEX,ELK3,HIPK2,CEBPA,NFIA
peptidase activity (GO:0008233)	0.5385233292208421	USP11,USP15,USP25,CPA3,NAPSA,CPD,ATG4D,ATG4A,CTSG,CTSF
specific transcriptional repressor activity (GO:0016566)	0.5409575347575557	UBP1
peptidase activator activity (GO:0016504)	0.5409575347575557	MAP3K5
phospholipid transporter activity (GO:0005548)	0.5409575347575557	ABCG1
small conjugating protein ligase activity (GO:0019787)	0.5583551527413009	UBE2H,UBE2C,ARIH1,UBE2E2
Rho GTPase activator activity (GO:0005100)	0.5604115723834633	JUN
N-methyltransferase activity (GO:0008170)	0.5604115723834633	WHSC1L1
carboxylic acid binding (GO:0031406)	0.5610292663787393	ALOX5AP,STX3
hematopoietin/interferon-class (D200-domain) cytokine receptor binding (GO:0005126)	0.5733362061097472	IL6ST,SOCS2
iron ion binding (GO:0005506)	0.5790432668504603	FECH
cell adhesion molecule binding (GO:0050839)	0.5968872902255608	ITGAL
carbon-carbon lyase activity (GO:0016830)	0.5968872902255608	HDC
metalloexopeptidase activity (GO:0008235)	0.5968872902255608	CPA3
vitamin binding (GO:0019842)	0.5968872902255608	SHMT1
ATPase activity, coupled to transmembrane movement of substances (GO:0042626)	0.5971919072062525	ABCA2,ABCG1
anion transmembrane transporter activity (GO:0008509)	0.6021825807891459	SLC4A1,CLCA1,CLCN3
methyltransferase activity (GO:0008168)	0.6087397591734262	SHMT1,WHSC1L1
endopeptidase activity (GO:0004175)	0.6139733205317783	NAPSA,USP11,USP15,ATG4D,CTSG,CTSF
phospholipase activity (GO:0004620)	0.620034481101009	PLD3,PLCG1
acid-amino acid ligase activity (GO:0016881)	0.6240201692220821	ARIH1,UBE2E2,UBE2H,UBE2C
Ras guanyl-nucleotide exchange factor activity (GO:0005088)	0.6303437826304031	RCBTB2
small GTPase regulator activity (GO:0005083)	0.6384358623815003	RCBTB2,HERC1,JUN
nucleic acid binding (GO:0003676)	0.6455833948999419	JUN,PABPC4,ELF2,LMO4,E2F2,CEBPA,KLF7,UBP1,ETS1,ETS2,KLF3,ETV6,HCLS1,FOXO4,RC3H2,AGFG1,EIF4H,FOS,XPC,NFAT5,ERCC4,MPG,IRF8,HMG20A,HLF,MXD1,HIST2H2BE,RNASEL,CBFB,HHEX,TRAF4,VAV1,CPSF6,H2AFY,STAU2,AFF1,THRA,HOXC5,SATB1,SOX4,ELK3,SOX6,RNF11,MAFG,CENPB,NFIA
cell surface binding (GO:0043498)	0.646018547399663	THBS1
ATPase activity, coupled to movement of substances (GO:0043492)	0.6524087809483756	ABCA2,ABCG1
protein N-terminus binding (GO:0047485)	0.6524087809483756	ALOX5AP,ERCC4
RNA splicing factor activity, transesterification mechanism (GO:0031202)	0.6610303472957372	TRA2B
sugar binding (GO:0005529)	0.6627017261774504	LGALS3,NDOR1
lyase activity (GO:0016829)	0.6723183140616213	HDC,FECH,GUCY1B3
ligand-dependent nuclear receptor activity (GO:0004879)	0.6754071504382648	THRA
RNA helicase activity (GO:0003724)	0.6754071504382648	RAD54B
ubiquitin binding (GO:0043130)	0.6754071504382648	ACVR1B
transcription regulator activity (GO:0030528)	0.6789033375233166	RREB1,JUN,ELF2,HTATIP2,LMO4,E2F2,CEBPA,ID2,KLF7,UBP1,ETS1,ETS2,KLF3,SCAI,ETV6,HCLS1,FOXO4,FOS,NFAT5,IRF8,HMG20A,CREG1,MXD1,MXD4,CBFB,HHEX,VAV1,MED6,AFF1,THRA,HOXC5,SOX4,SOX6,ELK3,MAFG,HIPK2,NFIA
phosphatase binding (GO:0019902)	0.6891757481162217	CARHSP1
lipase activity (GO:0016298)	0.6921139174173225	PLD3,PLCG1
zinc ion binding (GO:0008270)	0.7259382467515842	GDA,ARIH2,RNF11,KLF7,TRIM2,GCH1
Ras GTPase activator activity (GO:0005099)	0.7270835915128809	JUN
nucleotidyltransferase activity (GO:0016779)	0.744592230162947	DNTT,PCYT1B
specific RNA polymerase II transcription factor activity (GO:0003704)	0.7497570236906226	FOS
nuclear hormone receptor binding (GO:0035257)	0.7525543763369608	NSD1,WIPI1
electron carrier activity (GO:0009055)	0.7525543763369608	CYBA,ALDH2
receptor binding (GO:0005102)	0.7559958557041319	ADAM9,GRB10,TGFBR2,TGFBR3,ARHGEF12,IL18BP,NSD1,NUDT6,WIPI1,LCK,IGF1R,SELPLG,IL6ST,TRAK2,APOE,PDGFRB,S100A10,ICAM2,THBS1,SOCS2,GABARAPL2
S-adenosylmethionine-dependent methyltransferase activity (GO:0008757)	0.7603790726381524	WHSC1L1
DNA helicase activity (GO:0003678)	0.7603790726381524	RAD54B
phosphatase regulator activity (GO:0019208)	0.7603790726381524	PPP2R3A
helicase activity (GO:0004386)	0.7678393994865033	DNA2,RAD54B
translation initiation factor activity (GO:0003743)	0.770551402580116	EIF4H
Ras GTPase binding (GO:0017016)	0.7802930049814158	TRIOBP
serine-type peptidase activity (GO:0008236)	0.7822979110036138	CPD,CTSG
serine hydrolase activity (GO:0017171)	0.7892270983261405	CPD,CTSG
transcription cofactor activity (GO:0003712)	0.7936228577066858	KLF7,UBP1,HTATIP2,CREG1,SCAI,MXD1,MXD4,MED6,ELK3,HIPK2
protein C-terminus binding (GO:0008022)	0.8069133438050116	PRKCD,LCK,ERCC4
small GTPase binding (GO:0031267)	0.8153046656866774	TRIOBP
carboxylesterase activity (GO:0004091)	0.8153046656866774	PON2
voltage-gated potassium channel activity (GO:0005249)	0.8231506510273975	KCNA3
symporter activity (GO:0015293)	0.8231506510273975	SLC6A9
GTPase binding (GO:0051020)	0.8231506510273975	TRIOBP
mRNA binding (GO:0003729)	0.851347664941943	PABPC4
calcium channel activity (GO:0005262)	0.8576661071813682	RASA3
ubiquitin-protein ligase activity (GO:0004842)	0.8583374472763259	UBE2H,UBE2C
motor activity (GO:0003774)	0.8695106893633889	MYH10
ATPase activity, coupled (GO:0042623)	0.8780667611823908	ABCA2,ABCG1,MYH10
translation factor activity, nucleic acid binding (GO:0008135)	0.8949966668438727	EIF4H
